{
  "schemaVersion": "1",
  "approvalId": "apr_01J5ABCDEFGHJKMNPQRSTVWXY2",
  "actionId": "act_01J5ABCDEFGHJKMNPQRSTVWXY2",
  "correlationId": "corr_01J5ABCDEFGHJKMNPQRSTVWXY2",
  "authoritativeScopeHash": "sha256:2beccecb8ab7aa14afacf117fe81869dd275c1319a6add5ea8b2de90088c681c",
  "status": "cancelled",
  "requestedAt": "2026-07-25T20:02:01Z",
  "expiresAt": "2026-07-25T20:17:01Z",
  "requesterRef": "subject:requester-42",
  "authorizationDecisionId": "dec_01J5ABCDEFGHJKMNPQRSTVWXY3",
  "creationAuditRef": "audit_01J5ABCDEFGHJKMNPQRSTVWXY3",
  "decidedAt": "2026-07-25T20:03:01Z",
  "resolutionAuditRef": "audit_01J5ABCDEFGHJKMNPQRSTVWXY7",
  "resolutionDecisionId": "dec_01J5ABCDEFGHJKMNPQRSTVWXY7",
  "resolutionReasonCode": "approval_cancelled",
  "resolutionIdempotencyKey": "approval_01J5ABCDEFGHJKMNPQRSTVWXY7"
}
